{"schema_version":"pages-version-status.v1","observed_at":"2026-10-13T06:53:03Z","publication":"observed","observation":{"state":"fresh","checked_at":"2026-10-13T06:53:03Z","halt_stage":null,"reason":null},"counts":{"published":101,"received":96,"verified":96,"generated":96,"deployed":96,"pending":5,"blocked":5,"quarantined":49},"head":{"current_truth_release_digest":"sha256:2990f1c42cfd90ed690f0ea1a8930aaede59fc6bcac953ac35cbddff5ff6af48","upstream_latest_digest":"sha256:2990f1c42cfd90ed690f0ea1a8930aaede59fc6bcac953ac35cbddff5ff6af48","behind":0},"upstream":{"latest_published_at":"2026-10-13T02:01:51Z","stale_after_seconds":604800,"stale":false},"halt":{"stage":"received","reason":"pre-tip-replay-required","suspected_upstream_failure":false},"releases":[{"digest":"sha256:82df802f930db042a25d9f0eeb34a1faa2a8fa6f8f3a424ba32f02f13c8f824e","source_commit":"a7e70549cfdd424859891478ded0fb3d09107c00","published_at":"2026-08-29T11:23:21Z","stages":{"published":true,"received":false,"verified":false,"generated":false,"deployed":false},"furthest_stage":"published","bundle_asset":"present","halt":{"stage":"received","reason":"pre-tip-replay-required","suspected_upstream_failure":false},"quarantined_count":0},{"digest":"sha256:0414d1c2f8bed65e94b3195d13e8abc60bff49b89e3084dc5891db9c233e7e11","source_commit":"19c2dfeac96f9288393aa237fca8269439aff45b","published_at":"2026-09-01T04:54:08Z","stages":{"published":true,"received":false,"verified":false,"generated":false,"deployed":false},"furthest_stage":"published","bundle_asset":"present","halt":{"stage":"received","reason":"pre-tip-replay-required","suspected_upstream_failure":false},"quarantined_count":0},{"digest":"sha256:0e710d7ec621164cf71b0a751ba2c016b30e1ac1d1bc6cd6270f703c2b17193c","source_commit":"e9ecf637603d44eb7235e682f58c4a5eed75c57b","published_at":"2026-09-01T06:23:33Z","stages":{"published":true,"received":false,"verified":false,"generated":false,"deployed":false},"furthest_stage":"published","bundle_asset":"present","halt":{"stage":"received","reason":"pre-tip-replay-required","suspected_upstream_failure":false},"quarantined_count":0},{"digest":"sha256:219eb36c05bd497a1702cabe6d24b19b4bb118d015e69a9a0dd3eb74d9ef921a","source_commit":"2e8d13f16accfc54a83f766dcdcec93024a9bbdf","published_at":"2026-09-01T11:56:37Z","stages":{"published":true,"received":false,"verified":false,"generated":false,"deployed":false},"furthest_stage":"published","bundle_asset":"present","halt":{"stage":"received","reason":"pre-tip-replay-required","suspected_upstream_failure":false},"quarantined_count":0},{"digest":"sha256:c0d04258d27972c1cf58485e21d64dbcbe336405346ba95133913c64ba2856aa","source_commit":"745bf90812f7175f83e1235688249f9495f23bfc","published_at":"2026-09-01T17:03:03Z","stages":{"published":true,"received":true,"verified":true,"generated":true,"deployed":true},"furthest_stage":"deployed","bundle_asset":"present","halt":null,"quarantined_count":0},{"digest":"sha256:fff0e40e088e34925d17a75e36e388ea12a8fec3d5afdce9e37ea86399bbfe33","source_commit":"edc52b0f71fc5b3a55b446965ce50870e98898e7","published_at":"2026-09-07T21:14:59Z","stages":{"published":true,"received":true,"verified":true,"generated":true,"deployed":true},"furthest_stage":"deployed","bundle_asset":"present","halt":null,"quarantined_count":0},{"digest":"sha256:a730fcb55f530f752045b0b46d87b0a20c8c3d50290e5638bbf071faa3de5336","source_commit":"ccecd728ab9a7cce50794a33c11a79a67c4ca4be","published_at":"2026-09-08T00:20:49Z","stages":{"published":true,"received":true,"verified":true,"generated":true,"deployed":true},"furthest_stage":"deployed","bundle_asset":"present","halt":null,"quarantined_count":0},{"digest":"sha256:d53a5138332c6616b9c3610de14b83629fe340559d092a3f3029bea55c7e0d2c","source_commit":"6d1b4b7980ead20f9b9331a40cc8be9a2eeb3fff","published_at":"2026-09-08T05:16:58Z","stages":{"published":true,"received":true,"verified":true,"generated":true,"deployed":true},"furthest_stage":"deployed","bundle_asset":"present","halt":null,"quarantined_count":0},{"digest":"sha256:42008c5aeb64c94b118e4c9014c4b222f07af296e72e2f8493011735a5039af4","source_commit":"da39f6f761f0773daa081ba238f5d30e2e29feb8","published_at":"2026-09-08T14:48:28Z","stages":{"published":true,"received":true,"verified":true,"generated":true,"deployed":true},"furthest_stage":"deployed","bundle_asset":"present","halt":null,"quarantined_count":1},{"digest":"sha256:12615d293c012965f90b7135c831be92cc52e736fbc3144528258c8f89901ff2","source_commit":"d8e61aa4693a5513b9c8e0f57f7ac8848daba9dc","published_at":"2026-09-08T18:57:13Z","stages":{"published":true,"received":true,"verified":true,"generated":true,"deployed":true},"furthest_stage":"deployed","bundle_asset":"present","halt":null,"quarantined_count":1},{"digest":"sha256:25228cb0ea62dd06f9e15b92484ceb80f2f5d2358b5868daaa0000c2736c58c7","source_commit":"f267f5e1479f2ff7fa354d9467829ccd4aa28dd3","published_at":"2026-09-08T22:09:22Z","stages":{"published":true,"received":true,"verified":true,"generated":true,"deployed":true},"furthest_stage":"deployed","bundle_asset":"present","halt":null,"quarantined_count":1},{"digest":"sha256:5081ec0234d5a8fbe2fa2a6e3d5f123297a2a1b4f9589eb4ef04e7b58424af24","source_commit":"b9994986f3ccd57821b99c2dfc8990333bb0b452","published_at":"2026-09-09T00:35:28Z","stages":{"published":true,"received":true,"verified":true,"generated":true,"deployed":true},"furthest_stage":"deployed","bundle_asset":"present","halt":null,"quarantined_count":1},{"digest":"sha256:7762a05671a2f51f8d08f00c0b248e663f292ad53b7a90027b75cc4228cc4661","source_commit":"d527e3081957dbd440ca634d821e98b868abf534","published_at":"2026-09-09T06:13:39Z","stages":{"published":true,"received":true,"verified":true,"generated":true,"deployed":true},"furthest_stage":"deployed","bundle_asset":"present","halt":null,"quarantined_count":1},{"digest":"sha256:048ef40373de5a3d7a8469da281612a1a769d581512f6250c95ddbaed0d6cd04","source_commit":"e7e63c615460da48effcb4a76f96a3a6730af75d","published_at":"2026-09-09T11:44:40Z","stages":{"published":true,"received":true,"verified":true,"generated":true,"deployed":true},"furthest_stage":"deployed","bundle_asset":"present","halt":null,"quarantined_count":1},{"digest":"sha256:d36136f4141dff1eddaba80f0d849303970230bb0cda15c7a9959fb509c759f6","source_commit":"006b4f90f1125181e888425f1e3875a1230c8c94","published_at":"2026-09-09T16:56:11Z","stages":{"published":true,"received":true,"verified":true,"generated":true,"deployed":true},"furthest_stage":"deployed","bundle_asset":"present","halt":null,"quarantined_count":1},{"digest":"sha256:5a344bae92be45f43b4ca1e2f6a87b06375c905863e6fd23ca1434091b27de8a","source_commit":"24e7c4249d04f2647b5f6e3aa6f0d14fef6640ad","published_at":"2026-09-09T20:02:12Z","stages":{"published":true,"received":true,"verified":true,"generated":true,"deployed":true},"furthest_stage":"deployed","bundle_asset":"present","halt":null,"quarantined_count":1},{"digest":"sha256:41e8786e5402b78701b8efa061740b8c7d57e66c2242bc70ec439c4c768f036c","source_commit":"b5ff43c4e74d7db2fb13f5218a1c19d362942764","published_at":"2026-09-09T22:52:13Z","stages":{"published":true,"received":true,"verified":true,"generated":true,"deployed":true},"furthest_stage":"deployed","bundle_asset":"present","halt":null,"quarantined_count":1},{"digest":"sha256:c209c64ce43578b309d02f4015e28dd47cb74d47ef927287ad5b6847555f7fcd","source_commit":"24279623ef5253194f6c64ee3b3b627e62e3df50","published_at":"2026-09-10T01:21:48Z","stages":{"published":true,"received":true,"verified":true,"generated":true,"deployed":true},"furthest_stage":"deployed","bundle_asset":"present","halt":null,"quarantined_count":1},{"digest":"sha256:48725659e25a870e1523934e315d97c19f7e664069a9d4671386b12dee354c85","source_commit":"281d13391357851dd5cedf5fca4454bf85c82cd0","published_at":"2026-09-10T06:12:02Z","stages":{"published":true,"received":true,"verified":true,"generated":true,"deployed":true},"furthest_stage":"deployed","bundle_asset":"present","halt":null,"quarantined_count":1},{"digest":"sha256:f92bb95b3308a31517a69ad80051bc70135bb67e8cb39e1b94aac97d1cfeb5b7","source_commit":"044bb6cf9a858642c3826e08d382158e082a6901","published_at":"2026-09-10T20:02:15Z","stages":{"published":true,"received":true,"verified":true,"generated":true,"deployed":true},"furthest_stage":"deployed","bundle_asset":"present","halt":null,"quarantined_count":1},{"digest":"sha256:1be1f4960996be97835fb1927d59060a66ddda149293c0e69d7ce4770b5f7b2b","source_commit":"3602eceaf837d54ae52c396b69e320abbcb6a969","published_at":"2026-09-10T22:55:35Z","stages":{"published":true,"received":true,"verified":true,"generated":true,"deployed":true},"furthest_stage":"deployed","bundle_asset":"present","halt":null,"quarantined_count":1},{"digest":"sha256:cf9bee7e688fbe54011d005a15ea91e0d6b09e68a669bb80101dea9c8d637db6","source_commit":"3c9653d88527033923bae7538df7c72d320e8786","published_at":"2026-09-11T01:26:20Z","stages":{"published":true,"received":true,"verified":true,"generated":true,"deployed":true},"furthest_stage":"deployed","bundle_asset":"present","halt":null,"quarantined_count":1},{"digest":"sha256:0d4ef68705bd5f17d0e1706a092624ba6c48cb32c29aba5bac890e30c9d51c3f","source_commit":"182ec804e09c695c06df24f5022b2c429d475685","published_at":"2026-09-11T06:14:34Z","stages":{"published":true,"received":true,"verified":true,"generated":true,"deployed":true},"furthest_stage":"deployed","bundle_asset":"present","halt":null,"quarantined_count":1},{"digest":"sha256:4e7862db0418d9b41387941779e3455a2a9eafb22c2dee1ca29af44e1256fe60","source_commit":"199b2336d483479ecff0fa0c6e236ef96d6ef9c3","published_at":"2026-09-11T16:45:16Z","stages":{"published":true,"received":true,"verified":true,"generated":true,"deployed":true},"furthest_stage":"deployed","bundle_asset":"present","halt":null,"quarantined_count":1},{"digest":"sha256:91470b6d2702f78335e96cce78df1565f7be2ff9a61c103eb837c6700e93d47d","source_commit":"fd6b22ed0994850ccf233a2ed6bcbfb7e60d69ef","published_at":"2026-09-13T15:03:40Z","